{
  "schemaVersion": 1,
  "$schema": "../../../../Source/NeoStackAI/Resources/ExtensionUI.schema.json",
  "agentSummary": "Author DMX Fixture actors, light parameters, matrix dimensions, and fixture components from Lua.",
  "enablesAgentTo": [
    "Configure DMX fixture actor light and quality settings through the engine fixture APIs",
    "Add and configure single, double, and color fixture components on actors",
    "Push normalized DMX attribute values and inspect actual target/interpolated state"
  ],
  "whenToEnable": "Enable when a project uses the engine DMX Fixtures plugin for editable fixture actors or matrix fixture actors.",
  "domain": "dmx",
  "domainLabel": "DMX",
  "sortOrder": 51,
  "isRecommended": false,
  "isBetaVersion": false,
  "isExperimentalVersion": false
}
