{
  "schemaVersion": 1,
  "domain": "audio",
  "domainLabel": "Audio",
  "sortOrder": 58,
  "agentSummary": "Adds authoring support for UE Soundscape color and palette assets.",
  "enablesAgentTo": [
    "Create and configure Soundscape Color assets",
    "Create and configure Soundscape Palette color entries",
    "Persist Soundscape ambient-audio asset state for editor workflows"
  ],
  "whenToEnable": "Your project uses UE's beta Soundscape plugin for dynamic ambient audio palettes and sound colors.",
  "isRecommended": false,
  "isBetaVersion": true,
  "isExperimentalVersion": false
}
