{
  "schemaVersion": 1,
  "domain": "audio",
  "domainLabel": "Audio",
  "sortOrder": 55,
  "agentSummary": "Adds authoring support for UE AudioWidgets UMG controls in WidgetBlueprint assets.",
  "enablesAgentTo": [
    "Create WidgetBlueprints containing AudioWidgets controls",
    "Configure slider, radial slider, meter, oscilloscope, and vectorscope properties",
    "Persist and inspect AudioMaterial widget state"
  ],
  "whenToEnable": "Your project uses UE's AudioWidgets plugin for audio-focused UMG controls, meters, or analyzer panels.",
  "isRecommended": false,
  "isBetaVersion": false,
  "isExperimentalVersion": false
}
