{
  "schemaVersion": 1,
  "domain": "audio",
  "domainLabel": "Audio",
  "sortOrder": 54,
  "agentSummary": "Adds authoring support for UE Synthesis source and submix effect preset assets.",
  "enablesAgentTo": [
    "Create and configure Synthesis source-effect presets",
    "Create and configure Synthesis submix-effect presets",
    "Attach Synthesis presets to source-effect and submix chains"
  ],
  "whenToEnable": "Your project uses UE's Synthesis plugin for source effects, submix effects, or synth component authoring.",
  "isRecommended": false,
  "isBetaVersion": false,
  "isExperimentalVersion": false
}
