{
  "schemaVersion": 1,
  "domain": "audio",
  "domainLabel": "Audio",
  "sortOrder": 60,
  "agentSummary": "Adds authoring support for UE Sound Utilities assets.",
  "enablesAgentTo": [
    "Create and configure Sound Simple assets",
    "Author weighted SoundWave variation rows",
    "Persist volume and pitch variation ranges for simple randomized sounds"
  ],
  "whenToEnable": "Your project uses UE's beta Sound Utilities plugin for Sound Simple assets or audio helper workflows.",
  "isRecommended": false,
  "isBetaVersion": true,
  "isExperimentalVersion": false
}
