{
  "schemaVersion": 1,
  "domain": "audio",
  "domainLabel": "Audio",
  "sortOrder": 63,
  "agentSummary": "Adds authoring support for UE Audio Capture components.",
  "enablesAgentTo": [
    "Spawn Audio Capture components on level actors",
    "Configure capture jitter latency for microphone input components",
    "Inspect authored Audio Capture component state through generic LevelDesign reflection"
  ],
  "whenToEnable": "Your project uses UE's Audio Capture plugin for microphone input or audio-recording workflows.",
  "isRecommended": false,
  "isBetaVersion": false,
  "isExperimentalVersion": false
}
