{
  "schemaVersion": 1,
  "domain": "pipeline",
  "domainLabel": "Pipelines and tools",
  "sortOrder": 10,
  "agentSummary": "Adds tools for Interchange import pipelines, including FBX, glTF, USD, conversion rules, and import settings.",
  "enablesAgentTo": [
    "Inspect Interchange pipeline and import settings",
    "Configure asset conversion and import rules",
    "Help automate FBX, glTF, or USD import workflows",
    "Preview LOD and collision counts before importing"
  ],
  "whenToEnable": "Your project uses Unreal's Interchange pipeline for asset import.",
  "isRecommended": false
}
