{
  "schemaVersion": 1,
  "domain": "audio",
  "domainLabel": "Audio",
  "sortOrder": 57,
  "agentSummary": "Adds authoring support for UE Audio Synesthesia analyzer settings and NRT analyzer assets.",
  "enablesAgentTo": [
    "Create and configure Audio Synesthesia analyzer settings",
    "Create and configure NRT analyzer assets",
    "Attach NRT analyzer assets to settings assets"
  ],
  "whenToEnable": "Your project uses UE's beta Audio Synesthesia plugin for loudness, onset, constant-Q, meter, LKFS, or spectrum analysis assets.",
  "isRecommended": false,
  "isBetaVersion": true,
  "isExperimentalVersion": false
}
