{
  "schemaVersion": 1,
  "agentSummary": "Author Scene State tasks that execute Data Link graphs.",
  "enablesAgentTo": [
    "Configure Run Data Link task graph references",
    "Refresh and edit fixed Data Link input rows",
    "Inspect task instance state for Scene State/Data Link bridges"
  ],
  "whenToEnable": "Enable when a Motion Design Scene State graph needs to call a Data Link graph.",
  "domain": "motion-design",
  "domainLabel": "Motion Design",
  "sortOrder": 62,
  "isRecommended": false,
  "isBetaVersion": true,
  "isExperimentalVersion": false
}
