{
  "schemaVersion": 1,
  "domain": "audio",
  "domainLabel": "Audio",
  "sortOrder": 59,
  "agentSummary": "Adds authoring support for UE Sound Cue Template assets.",
  "enablesAgentTo": [
    "Create and configure Sound Cue Container templates",
    "Create and configure Sound Cue Distance Crossfade templates",
    "Inspect generated SoundCue graph nodes after template rebuilds"
  ],
  "whenToEnable": "Your project uses UE's beta Sound Cue Templates plugin for rapid audio-design SoundCue graphs.",
  "isRecommended": false,
  "isBetaVersion": true,
  "isExperimentalVersion": false
}
