{
  "schemaVersion": 1,
  "$schema": "../../../Source/NeoStackAI/Resources/ExtensionUI.schema.json",
  "name": "WaveTable",
  "agentSummary": "Adds authoring support for UE WaveTable bank assets.",
  "enablesAgentTo": [
    "Create and configure WaveTable banks",
    "Author WaveTable bank entries and transform curves",
    "Refresh banks and inspect generated table sample data"
  ],
  "whenToEnable": "Your project uses UE's beta Wave Tables plugin for audio modulation, synthesis, or wavetable-driven effects.",
  "domain": "audio",
  "domainLabel": "Audio",
  "sortOrder": 58,
  "isRecommended": false,
  "isBetaVersion": true,
  "isExperimentalVersion": false
}
