{
  "schemaVersion": 1,
  "$schema": "../../../Source/NeoStackAI/Resources/ExtensionUI.schema.json",
  "name": "MetaSound",
  "agentSummary": "Adds authoring support for UE MetaSound source and patch assets.",
  "enablesAgentTo": [
    "Create MetaSound Source and Patch assets",
    "Author graph inputs, outputs, variables, nodes, and builder connections",
    "Inspect serialized MetaSound frontend document state"
  ],
  "whenToEnable": "Your project uses UE MetaSound assets for procedural audio, sample-accurate DSP graphs, or audio parameter-driven sound design.",
  "domain": "audio",
  "domainLabel": "Audio",
  "sortOrder": 57,
  "isRecommended": true,
  "isBetaVersion": false,
  "isExperimentalVersion": false
}
